{
  "schema": "anarchadia.constitutional-artifact.v1",
  "generatedAt": "2026-07-28T00:00:00.000Z",
  "sourceCommunityScopedRef": "community_example_lantern",
  "artifactRef": "charter_example_lantern",
  "artifactKind": "charter",
  "declaredVersion": 1,
  "declaredStatus": "draft",
  "conflictState": "no recorded conflict",
  "expiry": "community-declared or none",
  "manualReviewRequired": true,
  "automaticEffect": false,
  "authorityDisclaimer": "This record reports a declared constitutional artifact. It does not certify authority, legitimacy, consensus, rights compliance, or ratification."
}
